{
  "$schema": "../../schemas/model.schema.json",
  "id": 77,
  "name": "US_SW07AL",
  "capabilities": {
    "interest": true,
    "inflation": true,
    "outputgap": true,
    "output": true,
    "mp_shock": true,
    "fiscal_shock": true,
    "rules": [
      3,
      4,
      5,
      6,
      7,
      11
    ]
  },
  "description": {
    "ac_ref": "Slobodyan & Wouters (2012)",
    "paper_title": "Learning in an estimated medium-scale DSGE model",
    "journal": "Journal of Economic Dynamics and Control 36 (1), pp. 26-46",
    "replicants_name": "S. Slobodyan",
    "pub_date": "2012",
    "keywords": [],
    "description": "",
    "category": "Adaptive learning model",
    "authors": [
      "Slobodyan, Sergey",
      "Wouters, Rafael"
    ]
  },
  "msr": [
    "0.8103",
    "0",
    "0",
    "0",
    "(1-0.8103)*2.0443",
    "0",
    "0",
    "0",
    "0",
    "0",
    "0",
    "0",
    "0",
    "((1-0.8103)*0.0882+0.2247)*4",
    "-0.2247*4",
    "0",
    "0",
    "0",
    "0",
    "0",
    "0",
    "0",
    "0",
    "0",
    "0",
    "0",
    "0",
    "0",
    "0",
    "0",
    "0",
    "1",
    "0.25"
  ],
  "variabledim": 1,
  "al": true,
  "al_info": {
    "forwards": [
      "c",
      "cf",
      "inve",
      "invef",
      "lab",
      "labf",
      "pinf",
      "inflationq",
      "pk",
      "pkf",
      "rk",
      "rkf",
      "w"
    ],
    "states_long": [
      "c",
      "cf",
      "inve",
      "invef",
      "kp",
      "kpf",
      "inflationq",
      "inflationqls",
      "w",
      "a",
      "b",
      "epinfma",
      "ewma",
      "g",
      "qs",
      "spinf",
      "sw",
      "interest"
    ],
    "states_short": [
      "c",
      "cf",
      "inve",
      "invef",
      "kp",
      "kpf",
      "inflationq",
      "w",
      "a",
      "b",
      "epinfma",
      "ewma",
      "g",
      "qs",
      "spinf",
      "sw",
      "interest"
    ]
  },
  "vars": [
    {
      "name": "a",
      "human_readable": "a"
    },
    {
      "name": "b",
      "human_readable": "b"
    },
    {
      "name": "c",
      "human_readable": "c"
    },
    {
      "name": "cf",
      "human_readable": "cf"
    },
    {
      "name": "eg",
      "human_readable": "eg"
    },
    {
      "name": "epinfma",
      "human_readable": "epinfma"
    },
    {
      "name": "ewma",
      "human_readable": "ewma"
    },
    {
      "name": "fispol",
      "human_readable": "fispol"
    },
    {
      "name": "g",
      "human_readable": "g"
    },
    {
      "name": "inflation",
      "human_readable": "inflation"
    },
    {
      "name": "inflationq",
      "human_readable": "inflationq"
    },
    {
      "name": "inflationql",
      "human_readable": "inflationql"
    },
    {
      "name": "inflationql2",
      "human_readable": "inflationql2"
    },
    {
      "name": "inflationqls",
      "human_readable": "inflationqls"
    },
    {
      "name": "interest",
      "human_readable": "interest"
    },
    {
      "name": "inve",
      "human_readable": "inve"
    },
    {
      "name": "invef",
      "human_readable": "invef"
    },
    {
      "name": "k",
      "human_readable": "k"
    },
    {
      "name": "kf",
      "human_readable": "kf"
    },
    {
      "name": "kp",
      "human_readable": "kp"
    },
    {
      "name": "kpf",
      "human_readable": "kpf"
    },
    {
      "name": "lab",
      "human_readable": "lab"
    },
    {
      "name": "labf",
      "human_readable": "labf"
    },
    {
      "name": "mc",
      "human_readable": "mc"
    },
    {
      "name": "ms",
      "human_readable": "ms"
    },
    {
      "name": "output",
      "human_readable": "output"
    },
    {
      "name": "outputgap",
      "human_readable": "outputgap"
    },
    {
      "name": "pinf",
      "human_readable": "pinf"
    },
    {
      "name": "pinf4",
      "human_readable": "pinf4"
    },
    {
      "name": "pk",
      "human_readable": "pk"
    },
    {
      "name": "pkf",
      "human_readable": "pkf"
    },
    {
      "name": "qs",
      "human_readable": "qs"
    },
    {
      "name": "r",
      "human_readable": "r"
    },
    {
      "name": "rk",
      "human_readable": "rk"
    },
    {
      "name": "rkf",
      "human_readable": "rkf"
    },
    {
      "name": "rrf",
      "human_readable": "rrf"
    },
    {
      "name": "spinf",
      "human_readable": "spinf"
    },
    {
      "name": "sw",
      "human_readable": "sw"
    },
    {
      "name": "w",
      "human_readable": "w"
    },
    {
      "name": "wf",
      "human_readable": "wf"
    },
    {
      "name": "y",
      "human_readable": "y"
    },
    {
      "name": "yf",
      "human_readable": "yf"
    },
    {
      "name": "zcap",
      "human_readable": "zcap"
    },
    {
      "name": "zcapf",
      "human_readable": "zcapf"
    }
  ],
  "shocks": [
    {
      "name": "ea",
      "human_readable": "ea"
    },
    {
      "name": "eb",
      "human_readable": "eb"
    },
    {
      "name": "em",
      "human_readable": "em"
    },
    {
      "name": "epinf",
      "human_readable": "epinf"
    },
    {
      "name": "eqs",
      "human_readable": "eqs"
    },
    {
      "name": "ew",
      "human_readable": "ew"
    },
    {
      "name": "fiscal_",
      "human_readable": "fiscal_"
    },
    {
      "name": "interest_",
      "human_readable": "interest_"
    }
  ]
}