{
  "$schema": "../../schemas/model.schema.json",
  "id": 8,
  "name": "NK_GM05",
  "capabilities": {
    "interest": true,
    "inflation": true,
    "outputgap": true,
    "output": true,
    "mp_shock": true,
    "fiscal_shock": false,
    "rules": [
      3,
      4,
      5,
      6,
      7,
      9,
      10,
      11
    ]
  },
  "description": {
    "ac_ref": "Gali & Monacelli (2005)",
    "paper_title": "Monetary policy and exchange rate volatility in a small open economy",
    "journal": "Review of Economic Studies 72, pp. 707-734",
    "replicants_name": "Likun Wang",
    "pub_date": "2005",
    "keywords": [],
    "description": "",
    "category": "Calibrated model",
    "authors": [
      "Gali, Jord√≠",
      "Monacelli, Tommaso"
    ]
  },
  "msr": null,
  "variabledim": 2,
  "al": false,
  "vars": [
    {
      "name": "a",
      "human_readable": "a"
    },
    {
      "name": "e",
      "human_readable": "e"
    },
    {
      "name": "inflation",
      "human_readable": "inflation"
    },
    {
      "name": "inflationq",
      "human_readable": "inflationq"
    },
    {
      "name": "interest",
      "human_readable": "interest"
    },
    {
      "name": "output",
      "human_readable": "output"
    },
    {
      "name": "outputgap",
      "human_readable": "outputgap"
    },
    {
      "name": "p",
      "human_readable": "p"
    },
    {
      "name": "ph",
      "human_readable": "ph"
    },
    {
      "name": "pi",
      "human_readable": "pi"
    },
    {
      "name": "pih",
      "human_readable": "pih"
    },
    {
      "name": "pistar",
      "human_readable": "pistar"
    },
    {
      "name": "r",
      "human_readable": "r"
    },
    {
      "name": "rnat",
      "human_readable": "rnat"
    },
    {
      "name": "s",
      "human_readable": "s"
    },
    {
      "name": "x",
      "human_readable": "x"
    },
    {
      "name": "y",
      "human_readable": "y"
    },
    {
      "name": "ynat",
      "human_readable": "ynat"
    },
    {
      "name": "ystar",
      "human_readable": "ystar"
    }
  ],
  "shocks": [
    {
      "name": "a_",
      "human_readable": "a_"
    },
    {
      "name": "interest_",
      "human_readable": "interest_"
    },
    {
      "name": "ystar_",
      "human_readable": "ystar_"
    }
  ],
  "al_info": null
}